{
  "id": "space_dash",
  "name": "Space Dash",
  "icon": "\ud83d\ude80",
  "description": "A fast arcade space shooter: dodge asteroids, blast rocks, chain multipliers.",
  "longDescription": "Space Dash is the reference content pack for the AgentOS web engine. Steer your ship through a procedurally spawning asteroid belt, shoot rocks to score, and chain kills quickly to build a multiplier up to x8. Your high score is saved through the AgentOS bridge and survives game updates. The entire game is a single self-contained HTML file \u2014 no remote resources, fully offline after install.",
  "category": "game",
  "version": "1.0.4",
  "author": "AgentOS",
  "engine": "web",
  "minEngineVersion": "1.0.0",
  "entry": "index.html",
  "screenshots": [],
  "assets": {
    "url": "https://raw.githubusercontent.com/maxnebula/agentos-store/main/dist/games/space_dash/bundle.zip",
    "sha256": "c8b9007fb11eb6b873bcc23d6993037f1154a13307ec831702d81988f3b59cc6",
    "size": 5824
  },
  "size": "6 KB"
}
