{
  "id": "d2048",
  "name": "2048",
  "icon": "\ud83d\udd22",
  "description": "Classic 2048 puzzle with smooth animations, touch swipe, and persistent high scores",
  "longDescription": "Swipe or drag to merge tiles and chase your best score. Features animated tile slides, merge effects, sound effects, and persistent high scores saved through the AgentOS bridge.",
  "category": "game",
  "version": "2.1.1",
  "author": "maxnebula",
  "engine": "web",
  "minEngineVersion": "1.0.0",
  "entry": "index.html",
  "assets": {
    "url": "https://raw.githubusercontent.com/maxnebula/agentos-store/main/dist/games/d2048/bundle.zip",
    "sha256": "9d5e2fa1fa07c3fa69976db8281f38cb30c12c84926865497aebdfa96cdb8774",
    "size": 5197
  },
  "size": "5 KB"
}
